subject_id,unit_id,unit_label,exam_format,question,choices,answer_index,explanation,keywords,source,review_status
"earth_base","earth_base_01","地球のすがた","csat","海溝周辺で発生する巨大地震（プレート境界型地震）のメカニズムに関する記述として、最も適当なものはどれか。","[""大陸プレートの沈み込みによって海洋プレートが引きずり込まれ、限界に達して跳ね返ることで発生する。"",""海洋プレートの沈み込みによって大陸プレートが引きずり込まれ、限界に達して跳ね返ることで発生する。"",""プレート内部に蓄積された張力によって、地殻の浅い部分に正断層が形成されることで発生する。"",""マントルプルームの上昇によってプレートが押し上げられ、地殻が割れることで発生する。""]","1","日本周辺の海溝では、海洋プレートが大陸プレートの下に沈み込んでいる。それに伴い大陸プレートの端が引きずり込まれ、ひずみが限界に達して大陸プレートが急激に跳ね返ることで巨大な海溝型地震が発生する。","[""プレート境界型地震"",""海溝型地震"",""巨大地震"",""沈み込み帯""]","seed","kept"
"earth_base","earth_base_01","地球のすがた","csat","内陸の活断層の活動によって発生する内陸型地震（直下型地震）の特徴として、正しいものはどれか。","[""マグニチュードが 8 を超える巨大地震になることが多く、広範囲に大津波を引き起こす。"",""震源が浅いことが多く、マグニチュードが比較的小さくても震央付近では甚大な被害をもたらすことがある。"",""プレートが深部へ沈み込む面に沿って発生する深発地震である。"",""海溝沿いに周期的に発生し、初期微動継続時間が非常に長いことが特徴である。""]","1","内陸型地震は、内陸の地殻内にある活断層が動くことで発生する。震源の深さが 約20km以浅 と浅いことが多く、マグニチュードが小さくても直上では激しい揺れとなる。兵庫県南部地震などがこれに該当する。","[""内陸型地震"",""活断層"",""直下型地震"",""震源""]","seed","kept"
"earth_base","earth_base_01","地球のすがた","csat","中央海嶺を挟んで両側の海底の岩石に残された古地磁気（過去の地球磁場の記録）を調べると、どのような特徴がみられるか。","[""海嶺に平行な地磁気の正逆の縞模様が、海嶺を軸にして非対称に分布している。"",""海嶺に垂直な地磁気の正逆の縞模様が、海嶺を軸にして対称に分布している。"",""海嶺に平行な地磁気の正逆の縞模様が、海嶺を軸にして対称に分布している。"",""古地磁気の向きはどこでも現在と同じであり、縞模様はみられない。""]","2","海洋底の玄武岩には、マグマが冷え固まった当時の地磁気の向きが記録されている。この地磁気の正逆の縞模様が海嶺を軸にして平行かつ対称に分布していることは、海洋底拡大説の強力な証拠となった。","[""古地磁気"",""海洋底拡大説"",""中央海嶺"",""地磁気の逆転""]","seed","kept"
"earth_base","earth_base_01","地球のすがた","csat","太平洋プレート上にあるハワイ諸島は、ホットスポットの火山活動によって形成された。ハワイ諸島を構成する火山の年齢と位置の関係として正しいものはどれか。","[""どの島も同時期に形成されたため、岩石の年齢はほぼ等しい。"",""ホットスポットから遠い島ほど岩石の年齢が古くなる。"",""ホットスポットから近い島ほど岩石の年齢が古くなる。"",""岩石の年齢とホットスポットからの距離に規則性はない。""]","1","ホットスポットはマントル深部に固定されたマグマの供給源である。プレートが移動するため、ホットスポット上で形成された火山はプレートとともに移動し、ホットスポットから離れた火山ほど形成年代が古くなる。","[""ホットスポット"",""ハワイ諸島"",""プレート運動"",""マントルプルーム""]","seed","kept"
"earth_base","earth_base_01","地球のすがた","csat","地球全体を構成する元素の質量割合を大きい順に並べたものとして、正しいものはどれか。","[""鉄、酸素、ケイ素、マグネシウム"",""酸素、ケイ素、アルミニウム、鉄"",""水素、ヘリウム、酸素、炭素"",""窒素、酸素、アルゴン、二酸化炭素""]","0","地球全体で最も質量割合が大きい元素は鉄であり、核の主成分である。次いで酸素、ケイ素、マグネシウムの順となる。一方、地殻のみでは酸素、ケイ素、アルミニウム、鉄の順（クラーク数）となる。","[""地球の構成元素"",""鉄"",""酸素"",""クラーク数""]","seed","kept"
"earth_base","earth_base_01","地球のすがた","csat","地震に伴って発生する津波の性質に関する記述として、最も適当なものはどれか。","[""水深が深い海域ほど、伝わる速さは遅くなる。"",""水深が深い海域ほど、伝わる速さは速くなる。"",""津波の伝わる速さは水深に関係なく常に一定である。"",""沖合では波高が非常に高く、海岸に近づくにつれて波高は低くなる。""]","1","津波の伝わる速度は水深が深いほど速い。そのため、沖合で発生した津波が浅い海岸に近づくと速度が遅くなる一方で、後ろの波が追いついて重なり波高（波の高さ）が急激に高くなる性質を持つ。","[""津波"",""水深"",""波高"",""地震""]","seed","kept"
"earth_base","earth_base_01","地球のすがた","csat","エラトステネスは、アレキサンドリアとシエネの間の距離と、夏至の日の太陽の南中高度の差を用いて地球の周囲の長さを求めた。このとき、彼が仮定したこととして最も適当なものを、次のうちから一つ選べ。","[""地球は完全な球形であり、太陽光線は平行に降り注ぐ。"",""地球は赤道方向に膨らんだ楕円体であり、太陽光線は平行に降り注ぐ。"",""地球は完全な球形であり、太陽からの距離は測定地によって異なる。"",""地球は赤道方向に膨らんだ楕円体であり、太陽からの距離は測定地によって異なる。""]","0","エラトステネスは、地球を完全な球形であるとし、太陽からの光は地球のどこにでも平行に降り注ぐと仮定して、地球の周囲の長さを計算した。","[""エラトステネス"",""地球の大きさ"",""太陽の南中高度""]","seed","kept"
"earth_base","earth_base_01","地球のすがた","csat","地球は自転の遠心力によって、赤道半径が極半径よりもわずかに長い回転楕円体に近い形をしている。このつぶれの度合いを表す扁平率の式として正しいものを、次のうちから一つ選べ。ただし、赤道半径を a、極半径を b とする。","[""(a - b) / a"",""(a - b) / b"",""a / (a - b)"",""b / (a - b)""]","0","扁平率 f は、赤道半径 a と極半径 b の差を赤道半径 a で割った値 f = (a - b) / a で表される。地球の扁平率は 約1/298 である。","[""地球楕円体"",""扁平率"",""赤道半径"",""極半径""]","seed","kept"
"earth_base","earth_base_01","地球のすがた","csat","地球の内部構造について説明した文として最も適当なものを、次のうちから一つ選べ。","[""地殻は主にかんらん岩などの密度が大きい岩石で構成されている。"",""マントルは主に鉄やニッケルなどの金属で構成されている。"",""外核は液体状の鉄やニッケルなどの金属で構成されている。"",""内核は液体の状態であり、地球の磁場の原因となっている。""]","2","地球の内部は、地殻、マントル、外核、内核に分かれている。地殻は花崗岩や玄武岩など、マントルはかんらん岩などの岩石からなり、外核は液体、内核は固体の鉄やニッケルを主成分とする。","[""地球の内部構造"",""地殻"",""マントル"",""外核"",""内核""]","seed","kept"
"earth_base","earth_base_01","地球のすがた","csat","地震波の速度が深さとともに急激に変化する境界面のうち、地殻とマントルの境界を何というか。最も適当なものを、次のうちから一つ選べ。","[""グーテンベルク不連続面"",""モホロビチッチ不連続面"",""レーマン不連続面"",""コンラッド不連続面""]","1","地殻とマントルの境界はモホロビチッチ不連続面と呼ばれる。マントルと外核の境界はグーテンベルク不連続面、外核と内核の境界はレーマン不連続面である。","[""モホロビチッチ不連続面"",""地殻"",""マントル"",""地震波""]","seed","kept"
"earth_base","earth_base_01","地球のすがた","csat","大陸地殻と海洋地殻の特徴を比較した説明として最も適当なものを、次のうちから一つ選べ。","[""大陸地殻は海洋地殻よりも薄く、密度が大きい。"",""大陸地殻は海洋地殻よりも薄く、密度が小さい。"",""大陸地殻は海洋地殻よりも厚く、密度が大きい。"",""大陸地殻は海洋地殻よりも厚く、密度が小さい。""]","3","大陸地殻の厚さは 約30kmから50km で主に花崗岩質岩石からなり密度が小さい。一方、海洋地殻の厚さは 約5kmから10km で主に玄武岩質岩石からなり密度が大きい。","[""大陸地殻"",""海洋地殻"",""地殻の厚さ"",""密度""]","seed","kept"
"earth_base","earth_base_01","地球のすがた","csat","プレートテクトニクスにおいて、地球の表面を覆う厚さ 100km 程度の硬い岩石の層を指す用語として最も適当なものを、次のうちから一つ選べ。","[""アセノスフェア"",""リソスフェア"",""メソスフェア"",""コア""]","1","地球の表面を覆う地殻と上部マントルの一部を合わせた硬い岩石の層をリソスフェア（岩石圏）と呼び、これがプレートに相当する。その下にある流動性を持つ層をアセノスフェア（岩流圏）と呼ぶ。","[""プレートテクトニクス"",""リソスフェア"",""アセノスフェア"",""プレート""]","seed","kept"
"earth_base","earth_base_01","地球のすがた","csat","海底山脈であり、新しい海洋プレートが生成されて左右に広がる境界である海嶺に関する記述として最も適当なものを、次のうちから一つ選べ。","[""プレートが沈み込む境界であり、深い海溝が形成される。"",""プレートがすれ違う境界であり、トランスフォーム断層が形成される。"",""マントル物質が上昇してマグマとなり、玄武岩質の新しい地殻が形成される。"",""大陸プレート同士が衝突する境界であり、大山脈が形成される。""]","2","海嶺は広がるプレート境界であり、地下深部からマントル物質が上昇してマグマを生じ、玄武岩質の新しい海洋地殻が生成されている。","[""海嶺"",""広がる境界"",""海洋プレート"",""マントル""]","seed","kept"
"earth_base","earth_base_01","地球のすがた","csat","海岸線の形状の類似や古生物の化石の分布などから、1912年 に大陸移動説を提唱した人物は誰か。最も適当なものを、次のうちから一つ選べ。","[""ヘス"",""ホームズ"",""ウェゲナー"",""モホロビチッチ""]","2","ドイツの気象学者ウェゲナーは、1912年 に大陸移動説を提唱し、かつてパンゲアという超大陸が存在したと考えた。","[""大陸移動説"",""ウェゲナー"",""パンゲア""]","seed","kept"
"earth_base","earth_base_01","地球のすがた","csat","日本列島周辺に存在する 4つ のプレートのうち、海洋プレートの組み合わせとして最も適当なものを、次のうちから一つ選べ。","[""ユーラシアプレートと北アメリカプレート"",""ユーラシアプレートとフィリピン海プレート"",""太平洋プレートと北アメリカプレート"",""太平洋プレートとフィリピン海プレート""]","3","日本列島周辺には、大陸プレートであるユーラシアプレートと北アメリカプレート、海洋プレートである太平洋プレートとフィリピン海プレートの計 4つ のプレートが存在している。","[""日本列島"",""海洋プレート"",""太平洋プレート"",""フィリピン海プレート""]","seed","kept"
"earth_base","earth_base_01","地球のすがた","csat","マグマの粘性が小さく、流動性の高い玄武岩質マグマの噴出によって形成される、傾斜が緩やかな火山の形状として最も適当なものを、次のうちから一つ選べ。","[""溶岩ドーム"",""成層火山"",""盾状火山"",""カルデラ""]","2","二酸化ケイ素 SiO₂ の含有量が少なく粘性が小さい玄武岩質マグマは、薄く広がって流れるため、傾斜の緩やかな盾状火山を形成しやすい。","[""マグマの粘性"",""盾状火山"",""玄武岩質マグマ"",""二酸化ケイ素""]","seed","kept"
"earth_base","earth_base_01","地球のすがた","csat","マグマが地下深部でゆっくりと冷え固まってできた岩石に見られる、同じくらいの大きさの粗い鉱物の結晶が組み合わさった組織を何というか。最も適当なものを、次のうちから一つ選べ。","[""斑状組織"",""等粒状組織"",""流理構造"",""柱状節理""]","1","マグマが地下深部でゆっくりと冷却されると、結晶が十分に成長し、同じくらいの大きさの粗い鉱物が組み合わさった等粒状組織をもつ深成岩となる。","[""火成岩"",""深成岩"",""等粒状組織"",""マグマ""]","seed","kept"
"earth_base","earth_base_01","地球のすがた","csat","二酸化ケイ素 SiO₂ の割合が 約70%以上 と多く、白っぽい色をした深成岩の名称として最も適当なものを、次のうちから一つ選べ。","[""玄武岩"",""流紋岩"",""斑れい岩"",""花崗岩""]","3","二酸化ケイ素 SiO₂ を多く含む白っぽい岩石のうち、深成岩は花崗岩、火山岩は流紋岩である。玄武岩と斑れい岩は SiO₂ が少なく黒っぽい岩石である。","[""深成岩"",""花崗岩"",""二酸化ケイ素"",""火成岩の分類""]","seed","kept"
"earth_base","earth_base_01","地球のすがた","csat","火成岩を構成する造岩鉱物のうち、鉄やマグネシウムを含まない無色鉱物の組み合わせとして最も適当なものを、次のうちから一つ選べ。","[""石英、斜長石"",""石英、黒雲母"",""角閃石、輝石"",""斜長石、かんらん石""]","0","火成岩を構成する造岩鉱物のうち、無色鉱物は石英と長石（斜長石やカリ長石）である。黒雲母、角閃石、輝石、かんらん石は鉄やマグネシウムを含む有色鉱物である。","[""造岩鉱物"",""無色鉱物"",""有色鉱物"",""石英"",""長石""]","seed","kept"
"earth_base","earth_base_01","地球のすがた","csat","地震波であるP波とS波の性質についての説明として最も適当なものを、次のうちから一つ選べ。","[""P波はS波よりも伝わる速さが遅く、主要動を引き起こす。"",""P波はS波よりも伝わる速さが速く、初期微動を引き起こす。"",""S波は縦波であり、固体・液体・気体のすべてを伝わる。"",""P波は横波であり、固体をのみ伝わる。""]","1","P波（縦波）は伝播速度が 約6km/sから8km/s と速く、初期微動を引き起こす。S波（横波）は伝播速度が 約3km/sから4km/s で主要動を引き起こすが、液体や気体の中は伝わらない。","[""地震波"",""P波"",""S波"",""初期微動"",""主要動""]","seed","kept"
"earth_base","earth_base_01","地球のすがた","csat","地震計の記録において、P波の到達からS波の到達までの時間を初期微動継続時間という。初期微動継続時間と震源からの距離の関係を述べた法則を何というか。最も適当なものを、次のうちから一つ選べ。","[""フックの法則"",""大森公式"",""ケプラーの法則"",""スネルの法則""]","1","初期微動継続時間は、震源からの距離にほぼ比例する。この関係を大森公式といい、震源距離を求めるのに用いられる。","[""初期微動継続時間"",""震源距離"",""大森公式"",""地震波""]","seed","kept"
"earth_base","earth_base_01","地球のすがた","csat","地震そのものの規模を表す尺度であるマグニチュード M が 2.0 大きくなると、地震のエネルギーは 約何倍 になるか。最も適当なものを、次のうちから一つ選べ。","[""約2倍"",""約10倍"",""約32倍"",""約1000倍""]","3","マグニチュード M が 1.0 大きくなると地震のエネルギーは 約32倍 になり、M が 2.0 大きくなると 32 × 32 = 1024倍（約1000倍）になる。","[""マグニチュード"",""地震のエネルギー"",""震度""]","seed","kept"
"earth_base","earth_base_01","地球のすがた","csat","ハワイ諸島のように、プレートの境界ではなくプレートの内部に位置し、マントル深部から固定されたマグマの供給源から継続的にマグマが噴出している場所を何というか。最も適当なものを、次のうちから一つ選べ。","[""海溝"",""トランスフォーム断層"",""ホットスポット"",""島弧""]","2","ホットスポットはマントル深部に固定されたマグマの供給源であり、プレートがその上を移動することで、ハワイ諸島のような直線状に並んだ火山列が形成される。","[""ホットスポット"",""ハワイ諸島"",""マントルプルーム"",""プレートテクトニクス""]","seed","kept"
"earth_base","earth_base_01","地球のすがた","csat","海洋底の古地磁気の縞模様の発見は、ある学説の強力な証拠となった。その学説として最も適当なものを、次のうちから一つ選べ。","[""海洋底拡大説"",""アイソスタシー説"",""ビッグバン宇宙論"",""斉一観""]","0","海嶺の両側に古地磁気の逆転の歴史が対称的な縞模様として記録されているという発見は、海嶺で新しい海洋底が生成され、左右に広がっているという海洋底拡大説の決定的な証拠となった。","[""地磁気"",""古地磁気"",""海洋底拡大説"",""海嶺""]","seed","kept"
"earth_base","earth_base_01","地球のすがた","csat","地殻がより密度の大きいマントルの上に浮かんでおり、高い山脈の下では地殻が深くマントルに食い込んで力のつり合いが保たれているとする考え方を何というか。最も適当なものを、次のうちから一つ選べ。","[""プレートテクトニクス"",""アイソスタシー"",""マントル対流"",""プルームテクトニクス""]","1","軽い地殻が重いマントルの上に浮いて力学的な均衡を保っている状態をアイソスタシーという。地表の標高が高い場所ほど、地下の地殻は厚くなる。","[""アイソスタシー"",""地殻"",""マントル"",""均衡""]","seed","kept"
"earth_base","earth_base_01","地球のすがた","csat","火山の噴火によって放出される固体の物質である火山砕屑物のうち、直径が 2mm以下 の細かい粒子のことを何というか。最も適当なものを、次のうちから一つ選べ。","[""火山弾"",""火山れき"",""火山灰"",""軽石""]","2","火山砕屑物は粒子の大きさによって分類され、直径が 64mm以上 を火山岩塊、2mm以上64mm未満 を火山れき、2mm以下 を火山灰という。","[""火山砕屑物"",""火山灰"",""火山れき"",""火山岩塊""]","seed","kept"
"earth_base","earth_base_01","地球のすがた","csat","アメリカ西海岸にあるサンアンドレアス断層のように、2つ のプレートが互いにすれ違うように水平に動いている境界に形成される大規模な断層を何というか。最も適当なものを、次のうちから一つ選べ。","[""逆断層"",""正断層"",""トランスフォーム断層"",""衝上断層""]","2","プレート同士がすれ違う境界ではトランスフォーム断層が形成され、浅い地震が頻発する。サンアンドレアス断層はその代表例である。","[""トランスフォーム断層"",""すれ違う境界"",""サンアンドレアス断層"",""プレートテクトニクス""]","seed","kept"
"earth_base","earth_base_01","地球のすがた","csat","地震が発生した地下の破壊開始点と、その真上の地表の点の名称の組み合わせとして最も適当なものを、次のうちから一つ選べ。","[""破壊開始点：震源、真上の点：震央"",""破壊開始点：震央、真上の点：震度"",""破壊開始点：震央、真上の点：震源"",""破壊開始点：震源、真上の点：震度""]","0","地下で岩石が破壊され地震が発生した場所を震源といい、その震源の真上に位置する地表の点を震央という。","[""震源"",""震央"",""地震""]","seed","kept"
"earth_base","earth_base_01","地球のすがた","csat","海溝から大陸側に向かって、地震の震源が次第に深くなるように傾斜して分布している地帯を何というか。最も適当なものを、次のうちから一つ選べ。","[""海嶺"",""和達・ベニオフ帯"",""トランスフォーム断層"",""ホットスポット""]","1","沈み込む海洋プレートに沿って地震が発生する面を深発地震面（和達・ベニオフ帯）と呼ぶ。これはプレートの沈み込みの強力な証拠となっている。","[""深発地震面"",""和達・ベニオフ帯"",""海溝"",""プレートの沈み込み""]","seed","kept"
"earth_base","earth_base_01","地球のすがた","csat","地球の固有磁場は、地球内部のある層で液体金属が対流することによって発生すると考えられている（ダイナモ理論）。この層として最も適当なものを、次のうちから一つ選べ。","[""地殻"",""マントル"",""外核"",""内核""]","2","地球の磁場は、液体の鉄やニッケルからなる外核で金属が対流することによって電流が発生し、それが電磁石の働きをして生じると考えられている。これをダイナモ理論という。","[""地球の磁場"",""ダイナモ理論"",""外核"",""液体金属""]","seed","kept"
"earth_base","earth_base_01","地球のすがた","csat","現在も地殻変動や火山活動が活発な環太平洋造山帯やアルプス・ヒマラヤ造山帯は、地質時代のどの時期以降に形成され始めたものか。最も適当なものを、次のうちから一つ選べ。","[""先カンブリア時代"",""古生代"",""中生代から新生代"",""将来形成される予定の造山帯""]","2","新期造山帯である環太平洋造山帯やアルプス・ヒマラヤ造山帯は、中生代から新生代にかけての比較的最近の地殻変動によって形成された、現在も活動が活発な地域である。","[""造山帯"",""新期造山帯"",""環太平洋造山帯"",""アルプス・ヒマラヤ造山帯""]","seed","kept"
"earth_base","earth_base_02","変動する地球","csat","プレート境界には発散境界、収束境界、すれ違う境界がある。発散境界に見られる地形として最も適当なものを選べ。","[""海嶺"",""海溝"",""弧状列島"",""トランスフォーム断層""]","0","発散境界はマントルからマグマが上昇して新しいプレートが作られる場所であり、海底には海嶺とよばれる山脈が形成される。海溝や弧状列島は収束境界に、トランスフォーム断層はすれ違う境界に見られる。","[""プレートテクトニクス"",""発散境界"",""海嶺""]","seed","kept"
"earth_base","earth_base_02","変動する地球","csat","日本列島周辺には4つのプレートが分布している。次のうち、海洋プレートに分類されるものの組み合わせとして正しいものを選べ。","[""ユーラシアプレートと北米プレート"",""ユーラシアプレートと太平洋プレート"",""太平洋プレートとフィリピン海プレート"",""北米プレートとフィリピン海プレート""]","2","日本列島周辺の4つのプレートのうち、太平洋プレートとフィリピン海プレートは海洋プレートであり、ユーラシアプレートと北米プレートは大陸プレートである。","[""海洋プレート"",""太平洋プレート"",""フィリピン海プレート"",""大陸プレート""]","seed","kept"
